{
  "schema_version": 1,
  "plan_id": "mtr-global-modernization-v4-20260809",
  "generated_at": "2026-10-01T06:46:19Z",
  "basis": {
    "branch": "codex/mtr-source-freeze-v3",
    "documentation_basis_head": "95648b978117b8964469ad4fb236829d9540c239",
    "runtime_checkpoint": "58d057c65098935e4b8c1b6c40f4965b45238dd5",
    "external_package_sha256": "E1863AB38C6B20FDB7A548CFC3029E2049BECA199D0C0F3DC74480253FC53F80",
    "source_work_package_index": "docs/global_modernization/v3/WORK_PACKAGE_INDEX.yaml"
  },
  "source_ledger": {
    "total": 95,
    "complete": 28,
    "pending": 54,
    "blocked": 3,
    "conditional": 10,
    "mandatory_total": 85,
    "mandatory_remaining": 57
  },
  "execution_ledger": {
    "mandatory_units_total": 73,
    "complete": 20,
    "ready": 1,
    "planned": 49,
    "blocked": 3,
    "mandatory_remaining": 53,
    "conditional_units_total": 7
  },
  "status_values": ["complete", "ready", "planned", "blocked", "conditional"],
  "decisions": [
    {"id": "D-GIT-01", "status": "accepted", "decision": "single repository URL; mtr-source-v3 is source projection and main is Pages artifact line"},
    {"id": "D-SIGN-01", "status": "blocked", "decision": null},
    {"id": "D-WEB-01", "status": "blocked", "decision": null},
    {"id": "D-CLEAN-01", "status": "blocked", "decision": null},
    {"id": "D-PLAY-01", "status": "deferred", "decision": "AAB is not applicable until Google Play is explicitly approved"},
    {"id": "D-PHYSICAL-01", "status": "deferred", "decision": "emulator-only QA by default"},
    {"id": "D-PCG-01", "status": "deferred", "decision": "M11 is non-release-blocking and disabled by default"}
  ],
  "units": [
    {"id":"RDX-01","phase":"P0","status":"complete","source_packages":[],"depends_on":[],"gates":["D4"],"objective":"Ingest v4, reconcile live indexes/topology/toolchain drift, create validated execution roadmap and adoption manifest."},
    {"id":"TC-01","phase":"P0","status":"complete","source_packages":[],"depends_on":["RDX-01"],"gates":["D4","P4_STATIC","ANDROID_PREFLIGHT"],"objective":"Make Android JDK 17 discovery fail-closed, remove silent JDK 21 fallback and bind the current toolchain without upgrading it."},

    {"id":"M02-DEC","phase":"P5","status":"blocked","source_packages":["M02.1"],"depends_on":["RDX-01"],"gates":["D4"],"blockers":["D-SIGN-01"],"objective":"Record production signing identity, backup ownership and upgrade compatibility; direct APK remains required and Play conditional."},
    {"id":"M02-WEB","phase":"P5","status":"blocked","source_packages":["M02.7"],"depends_on":["M12-D"],"gates":["P4","LIVE_PARITY"],"blockers":["D-WEB-01"],"objective":"Project the accepted source tree, deploy one immutable Pages artifact to main and prove live manifest parity."},
    {"id":"M02-RC","phase":"P5","status":"planned","source_packages":["M02.8"],"depends_on":["M02-WEB"],"gates":["RC2"],"objective":"Close M02 with source/content/artifact hashes, ABI, versions, certificate fingerprints and limitations."},

    {"id":"M03.3A","phase":"P1","status":"complete","source_packages":["M03.3"],"source_slice":"pure DevEvent contract and byte-bounded ring buffer","depends_on":["RDX-01"],"gates":["D4","P4_STATIC"],"objective":"Implement and test a Cocos-independent deterministic bounded development event log without runtime wiring."},
    {"id":"M03.3B","phase":"P1","status":"complete","source_packages":["M03.3"],"source_slice":"pure lifecycle epoch and stale-callback guard","depends_on":["M03.3A"],"gates":["D4","P4_STATIC"],"objective":"Implement lifecycle epoch primitives and deterministic stale-guard tests without changing gameplay ownership."},
    {"id":"M03.3C","phase":"P1","status":"complete","source_packages":["M03.3"],"source_slice":"GameRoot transition/reset adapter and runtime parity","depends_on":["M03.3B","TC-01"],"gates":["P4"],"objective":"Wire one release-off GameRoot adapter for transitions/reset/epoch and prove Web/Android-emulator parity."},
    {"id":"M03.4","phase":"P1","status":"complete","source_packages":["M03.4"],"depends_on":["M03.3C"],"gates":["P4","M2_PLUS"],"objective":"Route jump, glide, dash and pause through one input adapter with no duplicate listeners or debounce drift."},
    {"id":"M03.5","phase":"P1","status":"complete","source_packages":["M03.5"],"depends_on":["M03.4"],"gates":["P4","M2_PLUS"],"objective":"Wrap collision callbacks in typed events while preserving exact legacy side-effect order."},
    {"id":"M03.6","phase":"P1","status":"complete","source_packages":["M03.6"],"depends_on":["M03.5"],"gates":["P4","M2_PLUS"],"objective":"Extract power-up spawn/activate/tick/expire/cleanup into an epoch-aware owner with injected tick."},
    {"id":"M03.7A","phase":"P1","status":"complete","source_packages":["M03.7"],"source_slice":"ownership and cleanup proof with legacy retained","depends_on":["M03.6"],"gates":["P4","M2_PLUS"],"objective":"Remove UI/skin mutation authority and prove timer/listener/state cleanup without deleting old paths."},
    {"id":"M03.7B","phase":"P1","status":"complete","source_packages":["M03.7"],"source_slice":"approved legacy path removal","depends_on":["M03.7A"],"gates":["QA7","M2_PLUS"],"objective":"Delete only superseded M03 paths after parity, hidden-reference scan and rollback proof."},

    {"id":"M04-A","phase":"P2","status":"complete","source_packages":["M04.1","M04.2"],"depends_on":["M03.7B"],"gates":["D4","P4"],"objective":"Revalidate asset inventory and establish canonical ownership/provenance/atlas/bundle schema."},
    {"id":"M04-B","phase":"P2","status":"complete","source_packages":["M04.3","M04.4"],"depends_on":["M04-A"],"gates":["P4"],"objective":"Extend fail-visible asset validation and generate manifest-linked contact sheets."},
    {"id":"M04-C-PILOT","phase":"P2","status":"complete","source_packages":["M04.5"],"source_slice":"one measured co-visible atlas pilot","depends_on":["M04-B"],"gates":["P4","M2_PLUS"],"objective":"Migrate one low-risk atlas family with pivot/trim/rollback and before-after evidence."},
    {"id":"M04-C-FAMILY-ACHIEVEMENT-UI","phase":"P2","status":"complete","source_packages":["M04.5"],"source_slice":"measured nine-source achievement_ui static atlas child","depends_on":["M04-C-PILOT"],"gates":["P4","M2_PLUS"],"objective":"Migrate the bounded achievement UI family with exact source ownership, visual parity, rollback and Web/Android-emulator evidence."},
    {"id":"M04-C-FAMILY-RUNNER-COLLECTIBLES","phase":"P2","status":"complete","source_packages":["M04.5"],"source_slice":"measured fourteen-source runner_collectibles static atlas child","depends_on":["M04-C-FAMILY-ACHIEVEMENT-UI"],"gates":["P4","M2_PLUS"],"objective":"Migrate the gameplay-critical collectible family with exact source ownership, visual parity, rollback and Web/Android-emulator evidence."},
    {"id":"M04-C-FAMILY-BONUS-ITEMS","phase":"P2","status":"complete","source_packages":["M04.5"],"source_slice":"measured twelve-source bonus_items family using two directory-local static atlas descriptors","depends_on":["M04-C-FAMILY-RUNNER-COLLECTIBLES"],"gates":["P4","M2_PLUS"],"objective":"Migrate the gameplay bonus/equipment family without source relocation, with exact two-descriptor identity, visual parity, rollback and Web/Android-emulator evidence."},
    {"id":"M04-C-FAMILY-UI-SHARED-CORE","phase":"P2","status":"complete","source_packages":["M04.5"],"source_slice":"measured twenty-eight-source shared UI family using four directory-local static atlas descriptors plus one standalone banner","depends_on":["M04-C-FAMILY-BONUS-ITEMS"],"gates":["P4","M2_PLUS"],"objective":"Migrate the shared UI core without source relocation, with mixed-topology identity, visual parity, silent Web/Android-emulator QA and rollback evidence."},
    {"id":"M04-C-FAMILY-THEME-ARCHIVE","phase":"P2","status":"complete","source_packages":["M04.5"],"source_slice":"measured seventeen-source archive theme using one recursive parent static atlas descriptor","depends_on":["M04-C-FAMILY-UI-SHARED-CORE"],"gates":["P4","M2_PLUS"],"objective":"Migrate the archive hazard/platform family without source relocation, reject the initial Web draw regression, and retain exact visual, silent Android-emulator and rollback evidence."},
    {"id":"M04-C-FAMILY-THEME-FARM","phase":"P2","status":"complete","source_packages":["M04.5"],"source_slice":"measured twelve-source farm theme using one recursive parent static atlas descriptor","depends_on":["M04-C-FAMILY-THEME-ARCHIVE"],"gates":["P4","M2_PLUS"],"objective":"Migrate the farm hazard/platform family without source relocation, preserve exact visual parity, and retain silent Android-emulator, rollback and host-load-symmetric Web evidence."},
    {"id":"M04-C-FAMILY-THEME-CONSTRUCTION","phase":"P2","status":"complete","source_packages":["M04.5"],"source_slice":"measured twenty-four-source construction theme using one recursive parent static atlas descriptor","depends_on":["M04-C-FAMILY-THEME-FARM"],"gates":["P4","M2_PLUS"],"objective":"Migrate the construction hazard/platform family without source relocation, preserve exact visual parity, and retain silent Android-emulator, rollback and host-load-symmetric Web evidence."},
    {"id":"M04-C-FAMILY-THEME-LOGISTICS","phase":"P2","status":"ready","source_packages":["M04.5"],"source_slice":"26-source logistics theme; reviewed lifebuoy alpha fix; attempt01 rejected/rolled back; silent cold-boot tooling and attempt02 protocol revision3; native bootstrap finding open; inputs/runtime NOT_RUN","depends_on":["M04-C-FAMILY-THEME-CONSTRUCTION"],"gates":["P4","M2_PLUS"],"objective":"Retain the reviewed alpha fix, establish native bootstrap readiness, isolate cold/warm performance experiments and accept only a preregistered topology passing every gate; never choose the faster repeat."},